{
  "$schema": "https://json-schema.org/draft/2020-12/schema",
  "$id": "https://example.invalid/schemas/wedding-event-data.schema.json",
  "title": "Wedding guest experience event data",
  "type": "object",
  "required": [
    "couple",
    "event_dates",
    "venue",
    "schedule",
    "notification_material",
    "guest_services",
    "open_questions"
  ],
  "properties": {
    "couple": {
      "type": "object",
      "required": [
        "partner_one",
        "partner_two"
      ],
      "properties": {
        "partner_one": {
          "type": "string",
          "minLength": 1
        },
        "partner_two": {
          "type": "string",
          "minLength": 1
        }
      },
      "additionalProperties": false
    },
    "event_dates": {
      "type": "array",
      "minItems": 1,
      "items": {
        "type": "string",
        "format": "date"
      }
    },
    "venue": {
      "type": "object",
      "required": [
        "name",
        "locality",
        "address",
        "maps_url"
      ],
      "properties": {
        "name": {
          "type": "string",
          "minLength": 1
        },
        "locality": {
          "type": [
            "string",
            "null"
          ]
        },
        "address": {
          "type": [
            "string",
            "null"
          ]
        },
        "maps_url": {
          "$ref": "#/$defs/mapsUrl"
        },
        "landmark": {
          "type": [
            "string",
            "null"
          ]
        },
        "maps_label": {
          "type": [
            "string",
            "null"
          ]
        },
        "maps_embed_url": {
          "$ref": "#/$defs/mapsEmbedUrl"
        }
      },
      "additionalProperties": false
    },
    "schedule": {
      "type": "array",
      "items": {
        "$ref": "#/$defs/scheduleItem"
      }
    },
    "notification_material": {
      "type": "array",
      "items": {
        "$ref": "#/$defs/notificationItem"
      }
    },
    "guest_services": {
      "type": "array",
      "items": {
        "type": "object",
        "required": [
          "name",
          "availability",
          "display_on_website"
        ],
        "properties": {
          "name": {
            "type": "string"
          },
          "availability": {
            "type": "string"
          },
          "display_on_website": {
            "const": true
          }
        },
        "additionalProperties": false
      }
    },
    "contacts": {
      "type": "array",
      "items": {
        "type": "object",
        "required": [
          "name",
          "phones"
        ],
        "properties": {
          "name": {
            "type": "string",
            "minLength": 1
          },
          "phones": {
            "type": "array",
            "minItems": 1,
            "items": {
              "type": "string",
              "pattern": "^[6-9][0-9]{9}$",
              "description": "10-digit Indian mobile number without +91"
            }
          }
        },
        "additionalProperties": false
      }
    },
    "travel": {
      "type": "object",
      "required": [
        "stays",
        "transport"
      ],
      "properties": {
        "stays": {
          "type": "array",
          "items": {
            "type": "object",
            "required": [
              "id",
              "name",
              "audience",
              "note",
              "maps_url",
              "maps_embed_url"
            ],
            "properties": {
              "id": {
                "type": "string",
                "pattern": "^[a-z0-9-]+$"
              },
              "name": {
                "type": "string",
                "minLength": 1
              },
              "audience": {
                "enum": [
                  "guests",
                  "barat"
                ]
              },
              "note": {
                "type": [
                  "string",
                  "null"
                ]
              },
              "maps_url": {
                "$ref": "#/$defs/mapsUrl"
              },
              "maps_embed_url": {
                "$ref": "#/$defs/mapsEmbedUrl"
              }
            },
            "additionalProperties": false
          }
        },
        "check_in_note": {
          "type": [
            "string",
            "null"
          ]
        },
        "transport": {
          "type": "object",
          "required": [
            "status",
            "destinations",
            "note"
          ],
          "properties": {
            "status": {
              "$ref": "#/$defs/contentStatus"
            },
            "destinations": {
              "type": "array",
              "items": {
                "type": "string"
              }
            },
            "note": {
              "type": [
                "string",
                "null"
              ]
            },
            "timings": {
              "type": "array",
              "items": {
                "type": "object",
                "required": [
                  "label",
                  "from",
                  "to",
                  "tentative"
                ],
                "properties": {
                  "label": {
                    "type": "string",
                    "minLength": 1
                  },
                  "from": {
                    "type": "string",
                    "pattern": "^[0-2][0-9]:[0-5][0-9]$"
                  },
                  "to": {
                    "type": "string",
                    "pattern": "^[0-2][0-9]:[0-5][0-9]$"
                  },
                  "tentative": {
                    "type": "boolean"
                  }
                },
                "additionalProperties": false
              }
            }
          },
          "additionalProperties": false
        }
      },
      "additionalProperties": false
    },
    "rsvp": {
      "type": "object",
      "required": [
        "status",
        "method",
        "url",
        "whatsapp_number",
        "deadline",
        "note"
      ],
      "properties": {
        "status": {
          "$ref": "#/$defs/contentStatus"
        },
        "method": {
          "enum": [
            "whatsapp",
            "link"
          ],
          "description": "whatsapp: guests fill a short form that opens WhatsApp with their RSVP pre-written to whatsapp_number. link: the button opens url (e.g. a Google Form)."
        },
        "url": {
          "type": [
            "string",
            "null"
          ],
          "format": "uri",
          "pattern": "^https://"
        },
        "whatsapp_number": {
          "type": [
            "string",
            "null"
          ],
          "pattern": "^[6-9][0-9]{9}$",
          "description": "10-digit Indian mobile number that receives RSVPs"
        },
        "deadline": {
          "type": [
            "string",
            "null"
          ],
          "format": "date"
        },
        "note": {
          "type": [
            "string",
            "null"
          ]
        }
      },
      "additionalProperties": false
    },
    "dress_code": {
      "type": "object",
      "required": [
        "status",
        "items"
      ],
      "properties": {
        "status": {
          "$ref": "#/$defs/contentStatus"
        },
        "items": {
          "type": "array",
          "items": {
            "type": "object",
            "required": [
              "label",
              "guidance"
            ],
            "properties": {
              "label": {
                "type": "string"
              },
              "guidance": {
                "type": "string"
              },
              "applies_to": {
                "type": "array",
                "items": {
                  "type": "string",
                  "pattern": "^[a-z0-9-]+$"
                },
                "description": "Schedule item ids this guidance applies to"
              }
            },
            "additionalProperties": false
          }
        }
      },
      "additionalProperties": false
    },
    "open_questions": {
      "type": "array",
      "items": {
        "type": "object",
        "required": [
          "question",
          "owner",
          "needed_by"
        ],
        "properties": {
          "question": {
            "type": "string"
          },
          "owner": {
            "type": "string"
          },
          "needed_by": {
            "type": "string"
          }
        },
        "additionalProperties": false
      }
    }
  },
  "$defs": {
    "scheduleItem": {
      "type": "object",
      "required": [
        "id",
        "date",
        "start_time",
        "title",
        "location",
        "timing_status",
        "display_on_website",
        "channels"
      ],
      "properties": {
        "id": {
          "type": "string",
          "pattern": "^[a-z0-9-]+$"
        },
        "date": {
          "type": "string",
          "format": "date"
        },
        "start_time": {
          "type": "string",
          "pattern": "^[0-2][0-9]:[0-5][0-9]$"
        },
        "end_time": {
          "type": [
            "string",
            "null"
          ],
          "pattern": "^[0-2][0-9]:[0-5][0-9]$"
        },
        "title": {
          "type": "string"
        },
        "location": {
          "type": [
            "string",
            "null"
          ]
        },
        "timing_status": {
          "enum": [
            "confirmed",
            "provisional"
          ]
        },
        "display_on_website": {
          "const": true
        },
        "channels": {
          "type": "array",
          "minItems": 1,
          "items": {
            "enum": [
              "website",
              "whatsapp"
            ]
          }
        },
        "offsite": {
          "type": "boolean",
          "description": "true when the function is not at the main venue; location then names the other place"
        },
        "onwards": {
          "type": "boolean",
          "description": "true to show the start time as \"… onwards\""
        },
        "maps_url": {
          "$ref": "#/$defs/mapsUrl"
        },
        "maps_embed_url": {
          "$ref": "#/$defs/mapsEmbedUrl"
        },
        "maps_label": {
          "type": [
            "string",
            "null"
          ]
        },
        "location_needed": {
          "type": "boolean",
          "description": "false when no location should be shown (e.g. Vidayi)"
        },
        "address": {
          "type": [
            "string",
            "null"
          ],
          "description": "Street address shown under the location, for functions away from the main venue"
        }
      },
      "additionalProperties": false
    },
    "notificationItem": {
      "type": "object",
      "required": [
        "id",
        "date",
        "time",
        "title",
        "timing_status",
        "channels",
        "display_on_website"
      ],
      "properties": {
        "id": {
          "type": "string",
          "pattern": "^[a-z0-9-]+$"
        },
        "date": {
          "type": "string",
          "format": "date"
        },
        "time": {
          "type": "string",
          "pattern": "^[0-2][0-9]:[0-5][0-9]$"
        },
        "title": {
          "type": "string"
        },
        "timing_status": {
          "enum": [
            "confirmed",
            "provisional"
          ]
        },
        "channels": {
          "type": "array",
          "minItems": 1,
          "items": {
            "const": "whatsapp"
          }
        },
        "display_on_website": {
          "const": false
        }
      },
      "additionalProperties": false
    },
    "contentStatus": {
      "enum": [
        "pending",
        "tentative",
        "confirmed"
      ]
    },
    "mapsUrl": {
      "type": [
        "string",
        "null"
      ],
      "format": "uri",
      "pattern": "^https://(maps\\.app\\.goo\\.gl|www\\.google\\.com/maps)/"
    },
    "mapsEmbedUrl": {
      "type": [
        "string",
        "null"
      ],
      "format": "uri",
      "pattern": "^https://www\\.google\\.com/maps/embed\\?"
    }
  },
  "additionalProperties": false
}
