{
  "couple": {
    "partner_one": "Priya",
    "partner_two": "Sagar"
  },
  "event_dates": ["2026-11-19", "2026-11-20", "2026-11-21", "2026-11-22"],
  "venue": {
    "name": "CP Banquet",
    "locality": "Morena",
    "address": "In front of Hotel R B Tower, Ambah Bypass Road, Morena, Madhya Pradesh 476001",
    "landmark": "In front of Hotel R B Tower",
    "maps_url": "https://maps.app.goo.gl/XYeJygsmNaURs6M2A",
    "maps_label": "The map pin is on Hotel R B Tower; CP Banquet is directly in front of it.",
    "maps_embed_url": "https://www.google.com/maps/embed?pb=!1m18!1m12!1m3!1d892.575806516848!2d77.98663272839826!3d26.510370598642343!2m3!1f0!2f0!3f0!3m2!1i1024!2i768!4f13.1!3m3!1m2!1s0x3976ad0015be6a0f%3A0x441cff1384b99968!2sHOTEL%20R%20B%20TOWER!5e0!3m2!1sen!2sin!4v1791585642883!5m2!1sen!2sin"
  },
  "schedule": [
    {"id":"mehendi","date":"2026-11-19","start_time":"19:00","end_time":null,"title":"Mehendi","location":"Shree Gyan Seva Sadan, Morena","timing_status":"confirmed","display_on_website":true,"channels":["website","whatsapp"],"offsite":true,"onwards":true,"maps_url":"https://maps.app.goo.gl/DWfgzm9csrTYiEWZ6","maps_embed_url":"https://www.google.com/maps/embed?pb=!1m18!1m12!1m3!1d57128.84477997002!2d77.93346553125001!3d26.502340099999994!2m3!1f0!2f0!3f0!3m2!1i1024!2i768!4f13.1!3m3!1m2!1s0x3976ad0068e789bf%3A0xc1033b2f97ce24c3!2sShree%20Parshvanath%20Digambar%20Jain%20Panchayati%20Mandir!5e0!3m2!1sen!2sin!4v1791670992649!5m2!1sen!2sin","maps_label":"The map pin is on Shree Parshvanath Digambar Jain Panchayati Mandir."},
    {"id":"lagun","date":"2026-11-20","start_time":"09:00","end_time":null,"title":"Lagun","location":"Outer Hall","timing_status":"confirmed","display_on_website":true,"channels":["website","whatsapp"]},
    {"id":"lunch-20-nov","date":"2026-11-20","start_time":"11:00","end_time":null,"title":"Lunch","location":"Garden Area","timing_status":"confirmed","display_on_website":true,"channels":["website","whatsapp"]},
    {"id":"haldi","date":"2026-11-20","start_time":"13:30","end_time":null,"title":"Haldi","location":"Near the swimming pool at CP Banquet","timing_status":"confirmed","display_on_website":true,"channels":["website","whatsapp"]},
    {"id":"dinner-20-nov","date":"2026-11-20","start_time":"17:30","end_time":null,"title":"Dinner Starts","location":"Garden Area","timing_status":"confirmed","display_on_website":true,"channels":["website","whatsapp"]},
    {"id":"sangeet-dj","date":"2026-11-20","start_time":"19:30","end_time":null,"title":"Sangeet and Fun DJ Night","location":"Outer Hall","timing_status":"confirmed","display_on_website":true,"channels":["website","whatsapp"]},
    {"id":"barat-aagman","date":"2026-11-21","start_time":"16:00","end_time":null,"title":"Barat Aagman","location":"Main Gate of Banquet Hall","timing_status":"confirmed","display_on_website":true,"channels":["website","whatsapp"]},
    {"id":"dinner-21-nov","date":"2026-11-21","start_time":"16:00","end_time":"22:00","title":"Dinner Starts","location":"Garden Area","timing_status":"confirmed","display_on_website":true,"channels":["website","whatsapp"]},
    {"id":"bhatai-milap","date":"2026-11-21","start_time":"19:00","end_time":null,"title":"Bhatai Milap","location":"Outer Hall","timing_status":"confirmed","display_on_website":true,"channels":["website","whatsapp"]},
    {"id":"reception","date":"2026-11-21","start_time":"21:00","end_time":null,"title":"Reception","location":"Main Hall","timing_status":"confirmed","display_on_website":true,"channels":["website","whatsapp"]},
    {"id":"phere","date":"2026-11-21","start_time":"23:00","end_time":null,"title":"Phere","location":"Outer Hall","timing_status":"confirmed","display_on_website":true,"channels":["website","whatsapp"]},
    {"id":"vidayi","date":"2026-11-22","start_time":"07:00","end_time":null,"title":"Vidayi","location":null,"timing_status":"confirmed","display_on_website":true,"channels":["website","whatsapp"],"location_needed":false}
  ],
  "notification_material": [],
  "guest_services": [
    {"name":"Tea and coffee","availability":"Available throughout 20 November","display_on_website":true},
    {"name":"Tea and coffee","availability":"Available throughout 21 November","display_on_website":true}
  ],
  "contacts": [
    {"name":"Prasuk","phones":["8819855540","8287659815"]},
    {"name":"Virendra Kumar Jain","phones":["9827070960"]},
    {"name":"Paras","phones":["9320555755"]},
    {"name":"Sooraj","phones":["9098190258"]}
  ],
  "travel": {
    "stays": [
      {
        "id": "cp-banquet-stay",
        "name": "CP Banquet",
        "audience": "guests",
        "note": "Rooms attached to the wedding venue",
        "maps_url": null,
        "maps_embed_url": null
      },
      {
        "id": "rb-tower",
        "name": "Hotel R B Tower",
        "audience": "guests",
        "note": "Directly opposite CP Banquet",
        "maps_url": "https://maps.app.goo.gl/XYeJygsmNaURs6M2A",
        "maps_embed_url": "https://www.google.com/maps/embed?pb=!1m18!1m12!1m3!1d892.575806516848!2d77.98663272839826!3d26.510370598642343!2m3!1f0!2f0!3f0!3m2!1i1024!2i768!4f13.1!3m3!1m2!1s0x3976ad0015be6a0f%3A0x441cff1384b99968!2sHOTEL%20R%20B%20TOWER!5e0!3m2!1sen!2sin!4v1791585642883!5m2!1sen!2sin"
      },
      {
        "id": "upkar-palace",
        "name": "Hotel Upkar Palace",
        "audience": "barat",
        "note": "Booked for the Barat",
        "maps_url": "https://maps.app.goo.gl/1Anjzib3w8kCpYZQ6",
        "maps_embed_url": "https://www.google.com/maps/embed?pb=!1m18!1m12!1m3!1d3570.619089681506!2d77.99118800958875!3d26.500206677602453!2m3!1f0!2f0!3f0!3m2!1i1024!2i768!4f13.1!3m3!1m2!1s0x3976adbe2c7b768f%3A0xdcca235365107e0b!2sHotel%20Upkar%20Palace!5e0!3m2!1sen!2sin!4v1791585923482!5m2!1sen!2sin"
      }
    ],
    "check_in_note": "Guests checking in to the hotels must bring their Aadhaar card.",
    "transport": {
      "status": "tentative",
      "destinations": [
        "Mandir",
        "Railway station",
        "Barat hotel (Hotel Upkar Palace)"
      ],
      "timings": [
        {
          "label": "To the temple (Mandir)",
          "from": "06:30",
          "to": "08:30",
          "tentative": true
        }
      ],
      "note": "Vehicles will run between the venue and these places. Other timings will be announced on the WhatsApp group."
    }
  },
  "rsvp": {
    "status": "confirmed",
    "method": "whatsapp",
    "url": null,
    "whatsapp_number": "8819855540",
    "deadline": "2026-11-15",
    "note": "One RSVP per family, please — include everyone coming with you. Your RSVP helps us book and allot hotel rooms."
  },
  "dress_code": {
    "status": "confirmed",
    "items": [
      {
        "label": "Mehendi",
        "guidance": "Indian wear",
        "applies_to": [
          "mehendi"
        ]
      },
      {
        "label": "Lagun",
        "guidance": "Men: suit / formals · Women: chunri print saree",
        "applies_to": [
          "lagun"
        ]
      },
      {
        "label": "Haldi",
        "guidance": "Ethnic Indian wear / pastel kurta",
        "applies_to": [
          "haldi"
        ]
      },
      {
        "label": "Sangeet",
        "guidance": "Vibrant Indian kurta / ethnic Indian dress",
        "applies_to": [
          "sangeet-dj"
        ]
      },
      {
        "label": "Dinner",
        "guidance": "No dress code",
        "applies_to": [
          "dinner-20-nov",
          "dinner-21-nov"
        ]
      }
    ]
  },
  "open_questions": [
    {
      "question": "Which day(s) do the 6:30–8:30 AM temple vehicles run, and when will the other vehicle timings be confirmed?",
      "owner": "Family / transport coordinator",
      "needed_by": "Before 19 November"
    }
  ]
}
